id;config;context;active_step
1;functionalities;compressing;Bedfordshire
2;Maryland Configuration;Intranet Ergonomic Concrete Soap Zambian Kwacha;Concrete Bedfordshire
3;portal calculating Metal;real-time discrete redundant;Synergistic Personal Loan Account Sleek
4;Borders;olive Handcrafted Cotton Bacon Unbranded Fresh Pants;incubate
5;interfaces;Garden Dale Wallis and Futuna;generating
6;Computers Small Fresh Gloves back-end;interface;compress lavender Investment Account
7;backing up;Iran;Philippine Peso Metal
8;Strategist;card Licensed Cotton Ball;mindshare Gorgeous
9;Chips;navigating;Som Rustic Frozen Keyboard ROI
10;Benin;Tuna Response invoice;alarm Jamaica
